name,category,type,label_separation,cap_separation,wash_required,recyclable,material,decompose_time,eco_note
페트병,플라스틱,재활용품,필요,필요,필요,가능,PET,약 450년 이상,"플라스틱은 재활용되지만 분해되기까지 매우 오랜 시간이 걸립니다."
플라스틱 빨대,플라스틱,일회용품,불필요,불필요,불필요,불가,PP,약 200년,"재활용 불가능하며 해양 생물에게 해를 끼칠 수 있습니다."
종이컵,종이,일회용품,해당 없음,해당 없음,필요,조건부 가능,코팅 종이,약 20년,"겉면 코팅이 되어 있어 일반 종이보다 재활용이 어렵습니다."
...
신문지,종이류,재활용품,불필요,불필요,불필요,가능,종이,수개월,"물기 없이 펴서 묶어 배출, 비닐코팅 제외"
책자,종이류,재활용품,불필요,불필요,불필요,가능,종이,수개월,"비닐 코팅 표지, 스프링 제거 후 배출"
골판지상자,종이류,재활용품,불필요,불필요,불필요,가능,종이,수개월,"비닐코팅, 테이프, 철핀 제거 후 압착"
...
